subreddit,type,id,subreddit_name,title,text,author_id,created_utc,score,upvote_ratio,blank,permalink
r/AnarchyChess,Submissions,xmlhly,t5_2yvry,I finally figured out how Hans cheated,"So to win, he had to find a way to use engines mid game. What about this: he plays and studies the engines for years, memorizing all the major lines, until he basically has an engine in his head. 

And when it came down to play Magnus, he just activated hos brain engine and could see the evaluations of the game.  All while completely getting past the metal detectors and security. 

Truly a sly genius",afqqa18v,2022-09-24 06:48:58,88,0.98, ,/r/AnarchyChess/comments/xmlhly/i_finally_figured_out_how_hans_cheated/
r/AnarchyChess,Submissions,yd4m2f,t5_2yvry,Hans niemann opening,,na,2022-10-25 13:17:28,14,0.94, ,/r/AnarchyChess/comments/yd4m2f/hans_niemann_opening/
r/AnarchyChess,Submissions,yw7u3q,t5_2yvry,Is this Hans Niemann's car?,,48m4zkag,2022-11-15 19:59:10,6,0.88, ,/r/AnarchyChess/comments/yw7u3q/is_this_hans_niemanns_car/
r/AnarchyChess,Submissions,x7dcbd,t5_2yvry,How Hans Niemann cheated,,4ryzamok,2022-09-06 15:23:10,183,1.0, ,/r/AnarchyChess/comments/x7dcbd/how_hans_niemann_cheated/
r/AnarchyChess,Submissions,xwgmb0,t5_2yvry,Hans Niemann == Alex Jones Confirmed?,,edij3asf,2022-10-05 17:22:18,258,0.98, ,/r/AnarchyChess/comments/xwgmb0/hans_niemann_alex_jones_confirmed/
r/AnarchyChess,Submissions,xbl4ik,t5_2yvry,I'm the guy who tops Hans on Grindr. AMA.,Only butplug he was wearing was stretching him out for me.,2nrtjmcj,2022-09-11 15:15:16,32,0.88, ,/r/AnarchyChess/comments/xbl4ik/im_the_guy_who_tops_hans_on_grindr_ama/
r/AnarchyChess,Submissions,x6qv1u,t5_2yvry,The Hans of Satan (never out of prep),,9qimjcs2,2022-09-05 20:47:17,27,0.92, ,/r/AnarchyChess/comments/x6qv1u/the_hans_of_satan_never_out_of_prep/
r/AnarchyChess,Submissions,ys587f,t5_2yvry,How Hans actually beat Magnus,,iszrs,2022-11-11 08:45:38,13,0.93, ,/r/AnarchyChess/comments/ys587f/how_hans_actually_beat_magnus/
r/AnarchyChess,Submissions,xaw9ii,t5_2yvry,I'm the ex-boyfriend of Hans Niemann and I caught him cheating on me. AMA.,,gi690yny,2022-09-10 18:22:41,26,0.93, ,/r/AnarchyChess/comments/xaw9ii/im_the_exboyfriend_of_hans_niemann_and_i_caught/
r/AnarchyChess,Submissions,x6ud19,t5_2yvry,The reply I get for telling not to accuse Hans of cheating without proof...,"Guys ???!!!!

https://preview.redd.it/39zhoki9h4m91.png?width=725&format=png&auto=webp&v=enabled&s=9e0682d609a7dbaed61e6ff3fb1deb14f09a6f9c",mpfhaq3b,2022-09-05 23:13:49,30,0.97, ,/r/AnarchyChess/comments/x6ud19/the_reply_i_get_for_telling_not_to_accuse_hans_of/
