subreddit,type,id,subreddit_name,title,text,author_id,created_utc,score,upvote_ratio,blank,permalink
r/AnarchyChess,Submissions,zqrwis,t5_2yvry,Hans Niemann’s ex-girlfriend to testify against him; claims to have assisted Hans in inserting anal beads,,ev1ak,2022-12-20 15:53:32,1039,0.98, ,/r/AnarchyChess/comments/zqrwis/hans_niemanns_exgirlfriend_to_testify_against_him/
r/AnarchyChess,Submissions,11dwkz3,t5_2yvry,What do I do in this position? Hans Niemann is black btw,,5edepv5ul,2023-02-28 04:16:20,658,1.0, ,/r/AnarchyChess/comments/11dwkz3/what_do_i_do_in_this_position_hans_niemann_is/
r/AnarchyChess,Submissions,zojjmb,t5_2yvry,Hans Niemann arrested by Jamaican police,,3dz89uo,2022-12-17 23:28:39,10339,0.98, ,/r/AnarchyChess/comments/zojjmb/hans_niemann_arrested_by_jamaican_police/
r/AnarchyChess,Submissions,119gb4w,t5_2yvry,Hans Niemann on his Prep,,7uaomqax,2023-02-22 22:39:59,53,0.97, ,/r/AnarchyChess/comments/119gb4w/hans_niemann_on_his_prep/
r/AnarchyChess,Submissions,10mttws,t5_2yvry,"BREAKING NEWS: Hans Niemann’s cheating device was found after a recent game, here is the model he used if y’all wanna get good at chess",,vbvxu0ok,2023-01-27 19:36:06,362,0.99, ,/r/AnarchyChess/comments/10mttws/breaking_news_hans_niemanns_cheating_device_was/
r/AnarchyChess,Submissions,11dkshn,t5_2yvry,Guys I matched against freaking Hans Niemann but his bishop is missing from the start. WHERE IS THE BISHOP HANS??,,joait,2023-02-27 19:42:45,35,1.0, ,/r/AnarchyChess/comments/11dkshn/guys_i_matched_against_freaking_hans_niemann_but/
r/AnarchyChess,Submissions,10alm8k,t5_2yvry,Google Hans Niemann,,u17jfnvb,2023-01-13 04:54:11,433,0.99, ,/r/AnarchyChess/comments/10alm8k/google_hans_niemann/
r/AnarchyChess,Submissions,1126ph0,t5_2yvry,Hans Niemann AMA,,dwehrmu8,2023-02-14 14:29:53,9,0.91, ,/r/AnarchyChess/comments/1126ph0/hans_niemann_ama/
r/AnarchyChess,Submissions,y9exih,t5_2yvry,Chess.c*m added a Hans Niemann bot!!,,1m0n3im8,2022-10-21 00:35:47,9683,0.98, ,/r/AnarchyChess/comments/y9exih/chesscm_added_a_hans_niemann_bot/
r/AnarchyChess,Submissions,x8i09x,t5_2yvry,How Hans cheated. A mirror on the ceiling so he could see his opponents moves.,,fllsoza,2022-09-07 22:05:28,51909,0.99, ,/r/AnarchyChess/comments/x8i09x/how_hans_cheated_a_mirror_on_the_ceiling_so_he/
r/AnarchyChess,Submissions,10nmnmq,t5_2yvry,My ass was full so I made Hans Niemann’s device as a shoe insole!,,3pp4saqb,2023-01-28 19:02:45,115,0.99, ,/r/AnarchyChess/comments/10nmnmq/my_ass_was_full_so_i_made_hans_niemanns_device_as/
r/AnarchyChess,Submissions,10zb0bb,t5_2yvry,Hans Carlsen moment,,qghu5lbr,2023-02-11 03:28:41,63,0.94, ,/r/AnarchyChess/comments/10zb0bb/hans_carlsen_moment/
r/AnarchyChess,Submissions,xsfh7w,t5_2yvry,New Response just dropped… from Ben Finegold… I mean… Hans Niemann,,edij3asf,2022-09-30 23:09:04,6466,0.97, ,/r/AnarchyChess/comments/xsfh7w/new_response_just_dropped_from_ben_finegold_i/
r/AnarchyChess,Submissions,xwd8my,t5_2yvry,Make this comment section look like Hans Niemann's search history,,7zt8zy67,2022-10-05 15:12:34,2569,0.99, ,/r/AnarchyChess/comments/xwd8my/make_this_comment_section_look_like_hans_niemanns/
r/AnarchyChess,Submissions,xx2sx5,t5_2yvry,HOW DID NOONE NOTICE THIS??? Hans brought his phone to the game! The engine is not inside his banana you idiots,,6c9cfy0d,2022-10-06 11:22:43,7063,0.98, ,/r/AnarchyChess/comments/xx2sx5/how_did_noone_notice_this_hans_brought_his_phone/
r/AnarchyChess,Submissions,xoz8wr,t5_2yvry,Hans makes a statement,,icrpgeqf,2022-09-26 23:14:28,5507,0.99, ,/r/AnarchyChess/comments/xoz8wr/hans_makes_a_statement/
r/AnarchyChess,Submissions,xotklz,t5_2yvry,Magnus Carlsen Accuses Hans of Cheating,,nubko,2022-09-26 19:44:21,1875,0.99, ,/r/AnarchyChess/comments/xotklz/magnus_carlsen_accuses_hans_of_cheating/
r/AnarchyChess,Submissions,1106wx3,t5_2yvry,Hans Niememe,,15oxxo,2023-02-12 04:23:00,42,1.0, ,/r/AnarchyChess/comments/1106wx3/hans_niememe/
r/AnarchyChess,Submissions,yakgap,t5_2yvry,BREAKING NEWS!!!!! Magnus Carlsen calls Saul Goodman after being threated by Hans Niemann with a lawsuit.,,gamu8t4c,2022-10-22 10:42:44,3978,0.98, ,/r/AnarchyChess/comments/yakgap/breaking_news_magnus_carlsen_calls_saul_goodman/
r/AnarchyChess,Submissions,y9xwlh,t5_2yvry,Introducing a new piece: Hans Niemann's lawsuit. It doesn't go anywhere.,,cf3tprc,2022-10-21 16:22:45,4490,1.0, ,/r/AnarchyChess/comments/y9xwlh/introducing_a_new_piece_hans_niemanns_lawsuit_it/
r/AnarchyChess,Submissions,xvd6ef,t5_2yvry,So I made a prototype of the Hans Niemann Chess Engine. Thoughts?,,f86zt,2022-10-04 11:57:30,3643,1.0, ,/r/AnarchyChess/comments/xvd6ef/so_i_made_a_prototype_of_the_hans_niemann_chess/
r/AnarchyChess,Submissions,zxu0rs,t5_2yvry,Hans Niemann blunders mate in 1 against 1234 rated player. White to play and win in 1 move brilliancy.,,24f01e,2022-12-29 03:12:46,45,0.91, ,/r/AnarchyChess/comments/zxu0rs/hans_niemann_blunders_mate_in_1_against_1234/
r/AnarchyChess,Submissions,1151dyd,t5_2yvry,tiktok chess audience discussing Hans' title(they can't use Google),,6b0u40om,2023-02-17 23:51:15,5,0.86, ,/r/AnarchyChess/comments/1151dyd/tiktok_chess_audience_discussing_hans_titlethey/
r/AnarchyChess,Submissions,xiifit,t5_2yvry,Magnus Resigning Move 1 Vs. Hans,,q41bkoyu,2022-09-19 17:13:04,3438,1.0, ,/r/AnarchyChess/comments/xiifit/magnus_resigning_move_1_vs_hans/
r/AnarchyChess,Submissions,xqfu2m,t5_2yvry,"One of these images is of Hans Niemann, one is of a top super-GM. Which is which? If one of these images indicate a player who is ""not tense or fully concentrating in critical positions"", explain why. Names will be revealed in 12 hours.",,4dzyz,2022-09-28 15:33:49,2826,0.98, ,/r/AnarchyChess/comments/xqfu2m/one_of_these_images_is_of_hans_niemann_one_is_of/
r/AnarchyChess,Submissions,ya7340,t5_2yvry,I am not hans Niemann. AMA,,8j1eb9ke,2022-10-21 22:46:23,419,0.98, ,/r/AnarchyChess/comments/ya7340/i_am_not_hans_niemann_ama/
r/AnarchyChess,Submissions,zuhk7y,t5_2yvry,Hans Niemann was in to woodworking it seems,,5ftlehc7,2022-12-24 20:03:58,51,0.96, ,/r/AnarchyChess/comments/zuhk7y/hans_niemann_was_in_to_woodworking_it_seems/
r/AnarchyChess,Submissions,xqfpth,t5_2yvry,Hans' attorney makes a statement,,dneiu,2022-09-28 15:29:18,2100,0.99, ,/r/AnarchyChess/comments/xqfpth/hans_attorney_makes_a_statement/
r/AnarchyChess,Submissions,xjwtjg,t5_2yvry,"Magnus Carlsen and Hans Niemann playing on a beach in Miami, Aug 2022.",,zoybw,2022-09-21 06:16:20,4833,0.99, ,/r/AnarchyChess/comments/xjwtjg/magnus_carlsen_and_hans_niemann_playing_on_a/
r/AnarchyChess,Submissions,x6nrax,t5_2yvry,Hans Niemann responds to cheating insinuations from Magnus Carlsen,,4jity,2022-09-05 18:41:53,5304,0.98, ,/r/AnarchyChess/comments/x6nrax/hans_niemann_responds_to_cheating_insinuations/
r/AnarchyChess,Submissions,xw7fer,t5_2yvry,"why tf is everyone talking about hans moke niemann when his twin sister, hennes moke niemann, is sexy AF?!",,pkdwpsxl,2022-10-05 10:57:00,985,0.92, ,/r/AnarchyChess/comments/xw7fer/why_tf_is_everyone_talking_about_hans_moke/
r/AnarchyChess,Submissions,x7phr0,t5_2yvry,This is now a Hans Niemann fan subreddit. Tell us what you love most about Hans in the comments.,,k0hefbr4,2022-09-06 23:39:27,1213,0.98, ,/r/AnarchyChess/comments/x7phr0/this_is_now_a_hans_niemann_fan_subreddit_tell_us/
r/AnarchyChess,Submissions,zlkwfo,t5_2yvry,am i the only one that thinks this guy is Hans and that they arrested him for cheating?,,3wxpe0sm,2022-12-14 07:41:15,85,0.95, ,/r/AnarchyChess/comments/zlkwfo/am_i_the_only_one_that_thinks_this_guy_is_hans/
r/AnarchyChess,Submissions,z0aiy2,t5_2yvry,what’s the best move here? i’m hans neimann,,74paq50u,2022-11-20 17:55:16,203,0.99, ,/r/AnarchyChess/comments/z0aiy2/whats_the_best_move_here_im_hans_neimann/
r/AnarchyChess,Submissions,yhcf3u,t5_2yvry,Hans? Is that you?,,37k6h8ao,2022-10-30 11:52:03,825,0.98, ,/r/AnarchyChess/comments/yhcf3u/hans_is_that_you/
r/AnarchyChess,Submissions,116ura3,t5_2yvry,I just beat GM Hans Niemann in a blitz game on Lichess! (I'm white btw),[https://lichess.org/iA8eNMdq](https://lichess.org/iA8eNMdq),8f27jwqh,2023-02-20 01:58:39,0,0.5, ,/r/AnarchyChess/comments/116ura3/i_just_beat_gm_hans_niemann_in_a_blitz_game_on/
r/AnarchyChess,Submissions,xwkbdj,t5_2yvry,The troubles of /r/chess Hans supporters,,am4fa9q,2022-10-05 19:46:41,1343,0.96, ,/r/AnarchyChess/comments/xwkbdj/the_troubles_of_rchess_hans_supporters/
r/AnarchyChess,Submissions,yd508b,t5_2yvry,"After back-to-back losses against Hans Niemann and Gavin from 3rd grade, Magnus Carlsen announces he is now focusing on the future of strategic gaming.",,14vwdq,2022-10-25 13:35:37,1351,1.0, ,/r/AnarchyChess/comments/yd508b/after_backtoback_losses_against_hans_niemann_and/
r/AnarchyChess,Submissions,z8mqrk,t5_2yvry,Hans Niemann sends birthday gifts to Magnus Carlsen,,99jf3w6d,2022-11-30 09:09:41,389,0.99, ,/r/AnarchyChess/comments/z8mqrk/hans_niemann_sends_birthday_gifts_to_magnus/
r/AnarchyChess,Submissions,yexru9,t5_2yvry,Magnus is eerily starting to look more and more like Hans,,27aclg8p,2022-10-27 17:20:31,527,0.99, ,/r/AnarchyChess/comments/yexru9/magnus_is_eerily_starting_to_look_more_and_more/
r/AnarchyChess,Submissions,xiiprw,t5_2yvry,Chad Hans strikes again,,quvge,2022-09-19 17:23:25,1706,0.97, ,/r/AnarchyChess/comments/xiiprw/chad_hans_strikes_again/
r/AnarchyChess,Submissions,xr5n4w,t5_2yvry,"One of these graphs is the ""age"" distribution of Hans Niemann, one is of a top super-GM. Which is which? If one of these graphs indicates aging, explain why. Names will be revealed in 12 hours.",,o1iie,2022-09-29 11:43:57,1399,0.99, ,/r/AnarchyChess/comments/xr5n4w/one_of_these_graphs_is_the_age_distribution_of/
r/AnarchyChess,Submissions,y80a7s,t5_2yvry,This photo of Hans after the game with Samuel Sevian reminded me of something,,ame4t,2022-10-19 11:33:43,1912,0.99, ,/r/AnarchyChess/comments/y80a7s/this_photo_of_hans_after_the_game_with_samuel/
r/AnarchyChess,Submissions,xwh35o,t5_2yvry,Hans after chess.com's report,,cl7zxoiq,2022-10-05 17:40:17,706,0.99, ,/r/AnarchyChess/comments/xwh35o/hans_after_chesscoms_report/
r/AnarchyChess,Submissions,x6e45l,t5_2yvry,Hans Niemann carreer evolution (2011 - 2025),,alian,2022-09-05 11:41:59,5316,0.99, ,/r/AnarchyChess/comments/x6e45l/hans_niemann_carreer_evolution_2011_2025/
r/AnarchyChess,Submissions,xt3waa,t5_2yvry,"Comparing Hans Niemann engine correlation with Domino's Pizza Share Price, with respect to Norwegian Car Emissions",,njjq7,2022-10-01 19:25:56,1209,0.99, ,/r/AnarchyChess/comments/xt3waa/comparing_hans_niemann_engine_correlation_with/
r/AnarchyChess,Submissions,xwa0gx,t5_2yvry,Why are we focusing on Hans when anonymous confessed gm has cheated so many times yet is still allowed on chess.c*m.,,iesgkki,2022-10-05 12:59:24,663,1.0, ,/r/AnarchyChess/comments/xwa0gx/why_are_we_focusing_on_hans_when_anonymous/
r/AnarchyChess,Submissions,xiu7wv,t5_2yvry,agadmator reviews Hans vs Magnus game,,o3xw1,2022-09-20 00:50:09,1965,0.99, ,/r/AnarchyChess/comments/xiu7wv/agadmator_reviews_hans_vs_magnus_game/
r/AnarchyChess,Submissions,xiiczj,t5_2yvry,Magnus resigns after yet another engine move (C4 on move 2) from Hans.,,7hyovzb4,2022-09-19 17:10:27,1413,0.99, ,/r/AnarchyChess/comments/xiiczj/magnus_resigns_after_yet_another_engine_move_c4/
r/AnarchyChess,Submissions,xgxtgc,t5_2yvry,WHERE'S THE RAT HANS?!,,1m0n3im8,2022-09-17 21:12:20,3892,0.99, ,/r/AnarchyChess/comments/xgxtgc/wheres_the_rat_hans/
r/AnarchyChess,Submissions,10o9lxw,t5_2yvry,Hans Niemann’s chess device,,2h3q9sfz,2023-01-29 15:00:25,7,1.0, ,/r/AnarchyChess/comments/10o9lxw/hans_niemanns_chess_device/
r/AnarchyChess,Submissions,ynortd,t5_2yvry,Hans Niemann playing chess,,75mrft,2022-11-06 12:33:36,550,0.97, ,/r/AnarchyChess/comments/ynortd/hans_niemann_playing_chess/
r/AnarchyChess,Submissions,y3rhl0,t5_2yvry,I just defeated Hans. Ask me anything,,7jby4hqi,2022-10-14 11:35:47,324,0.99, ,/r/AnarchyChess/comments/y3rhl0/i_just_defeated_hans_ask_me_anything/
r/AnarchyChess,Submissions,xeunb1,t5_2yvry,"You've heard of Hans Niemann accused of using anal beads against GM Anus, now get ready for..",,3bed4a21,2022-09-15 11:42:15,2194,0.99, ,/r/AnarchyChess/comments/xeunb1/youve_heard_of_hans_niemann_accused_of_using_anal/
r/AnarchyChess,Submissions,xvxfqx,t5_2yvry,Hans Niemann releases a statement,,nii9ljry,2022-10-05 01:58:52,1803,0.99, ,/r/AnarchyChess/comments/xvxfqx/hans_niemann_releases_a_statement/
r/AnarchyChess,Submissions,x6oe6h,t5_2yvry,Hans Niemann THE GOAT,,62z0uz1k,2022-09-05 19:08:08,1356,0.98, ,/r/AnarchyChess/comments/x6oe6h/hans_niemann_the_goat/
r/AnarchyChess,Submissions,xom3z0,t5_2yvry,Hans Niemann gives a response,,gw4ai4zp,2022-09-26 15:14:12,1479,0.99, ,/r/AnarchyChess/comments/xom3z0/hans_niemann_gives_a_response/
r/AnarchyChess,Submissions,xscaot,t5_2yvry,"Comparing Hans Niemann engine correlation with Magnus Carlsen and Vincent Keymer, with respect to opponent rating and FIDE title",,8qszslve,2022-09-30 20:53:49,879,1.0, ,/r/AnarchyChess/comments/xscaot/comparing_hans_niemann_engine_correlation_with/
r/AnarchyChess,Submissions,xy5wnm,t5_2yvry,New Hans Niemann theory ‼️,,5buc2yu7,2022-10-07 18:04:28,1251,1.0, ,/r/AnarchyChess/comments/xy5wnm/new_hans_niemann_theory/
r/AnarchyChess,Submissions,xy1ril,t5_2yvry,"""Why does Hans, the largest player, not simply eat the other players?""",,xg5ag,2022-10-07 15:15:50,772,0.99, ,/r/AnarchyChess/comments/xy1ril/why_does_hans_the_largest_player_not_simply_eat/
r/AnarchyChess,Submissions,xhtvbz,t5_2yvry,"Hans Niemann is now under the ""Popular culture"" section for the Wikipedia article on anal beads. We did it, guys.",,71u6o,2022-09-18 22:19:12,979,0.99, ,/r/AnarchyChess/comments/xhtvbz/hans_niemann_is_now_under_the_popular_culture/
r/AnarchyChess,Submissions,y7rgmh,t5_2yvry,Hans Niemann causing a spike in interest in anal beads in the US during the last 7 weeks,,yw5af,2022-10-19 03:23:18,446,0.99, ,/r/AnarchyChess/comments/y7rgmh/hans_niemann_causing_a_spike_in_interest_in_anal/
r/AnarchyChess,Submissions,xmqr81,t5_2yvry,I work at a grocery store across the street from the St. Louis Chess Club. I have interacted with Hans on multiple occasions,"I saw Hans at the grocery store in St Louis yesterday. I told him how cool it was to meet him in person, but I didn’t want to be a douche and bother him and ask him for photos or anything.

He said, “Oh, like you’re doing now?”

I was taken aback, and all I could say was “Huh?” but he kept cutting me off and going “huh? huh? huh?” and closing his hand shut in front of my face. I walked away and continued with my shopping, and I heard him chuckle as I walked off. When I came to pay for my stuff up front I saw him trying to walk out the doors with like fifteen Milky Ways in his hands without paying.

The girl at the counter was very nice about it and professional, and was like “Sir, you need to pay for those first.” At first he kept pretending to be tired and not hear her, but eventually turned back around and brought them to the counter.

When she took one of the bars and started scanning it multiple times, he stopped her and told her to scan them each individually “to prevent any electrical infetterence,” and then turned around and winked at me. I don’t even think that’s a word. After she scanned each bar and put them in a bag and started to say the price, he kept interrupting her by yawning really loudly.",6d5hpwad,2022-09-24 11:49:08,561,0.98, ,/r/AnarchyChess/comments/xmqr81/i_work_at_a_grocery_store_across_the_street_from/
r/AnarchyChess,Submissions,x95xbc,t5_2yvry,Hans Niemann cheated,"“M-Magnus! I didn’t think you’d get home this early!” Hans stuttered, completely in shock. 

Magnus stood, heartbroken, staring at his soon to be husband.

“How could you?”

“It’s not what it looks like!” Hans stammered, wrapping himself up in covers. 

“We were just about to reveal our love to the world!” Magnus shouted in fury, “What am I gonna tell all our friends? What am I gonna tell Hikaru?!?!”

Hans looked at the floor while the guilt finally hit him.

Suddenly, a figure emerged from the bed and revealed himself. Ben Finegold. 

Covering his modesty, he spoke in a quiet shameful whisper, “I’m sorry Magnus. It was my birthday after all. The truth hurts.” 

Ben retrieved his brick from the bed, and walked towards the door while Magnus stared in shock and heartbreak. 

Magnus’s gaze returned to Hans. “It’s over.”

Hans’s eyes filled with tears. 

“Magnus wait- what about the tournament?! What about our love?!”

“I’m withdrawing from the tournament. I never want to see you again.” Magnus stated, coldly.

Magnus stormed out of the room and slammed the door. 

Hans finally broke down in tears, devastated.",dq0xc3p,2022-09-08 17:06:44,1637,0.99, ,/r/AnarchyChess/comments/x95xbc/hans_niemann_cheated/
r/AnarchyChess,Submissions,xuhhf8,t5_2yvry,Cam Site Offers Hans Niemann $1 Million to Play Chess Nude to Prove He Didn't Cheat,,na,2022-10-03 12:00:28,302,0.87, ,/r/AnarchyChess/comments/xuhhf8/cam_site_offers_hans_niemann_1_million_to_play/
r/AnarchyChess,Submissions,xvraa9,t5_2yvry,Is there a way to salvage this position? I am playing as Hans,,1qe26vq6,2022-10-04 21:29:05,358,0.99, ,/r/AnarchyChess/comments/xvraa9/is_there_a_way_to_salvage_this_position_i_am/
r/AnarchyChess,Submissions,x7qhy7,t5_2yvry,The Virgin GM vs The Chad Hans Niemann,,8ciw72n8,2022-09-07 00:24:50,1277,0.97, ,/r/AnarchyChess/comments/x7qhy7/the_virgin_gm_vs_the_chad_hans_niemann/
r/AnarchyChess,Submissions,xwmlvn,t5_2yvry,Magnus Carlsen is dating Hans Niemann?,"So apparently there's a 72-page report discussing the ""Niemann-Carlsen affair""?

I don't think it's wrong for two GMs to date, but IMs (except for Eric Rosen) should not be allowed to date as an incentive for them to become GMs.

I also think it's a little inappropriate to write 72 pages on a private relationship between Magnus and Hans, especially when the use of anal beads is so heavily implicated.

Apparently the report also implicates hundreds of other GMs. We all know Magnus fucks, but it's a little hard to believe that he has affairs with hundreds of GMs. 

Am I out of line here? Should IMs be allowed to date? Is it weird that they published 72-pages of evidence that Magnus is dating Hans?",bd6q5,2022-10-05 21:16:07,615,0.99, ,/r/AnarchyChess/comments/xwmlvn/magnus_carlsen_is_dating_hans_niemann/
r/AnarchyChess,Submissions,y97260,t5_2yvry,Hans: My lawsuit speaks for itself,,9fhucpqh,2022-10-20 19:11:47,67,0.97, ,/r/AnarchyChess/comments/y97260/hans_my_lawsuit_speaks_for_itself/
r/AnarchyChess,Submissions,xwxu3z,t5_2yvry,I am Hans Niemann's lawyer. Ask me anything.,,qdbir,2022-10-06 06:06:57,58,0.98, ,/r/AnarchyChess/comments/xwxu3z/i_am_hans_niemanns_lawyer_ask_me_anything/
r/AnarchyChess,Submissions,yawjb1,t5_2yvry,Hans Niemann spotted !!!,,caj11gh8,2022-10-22 19:36:44,402,0.98, ,/r/AnarchyChess/comments/yawjb1/hans_niemann_spotted/
r/AnarchyChess,Submissions,z06yhu,t5_2yvry,Should they ban Hans Niemann from competitive biking?,,na,2022-11-20 15:30:37,72,0.94, ,/r/AnarchyChess/comments/z06yhu/should_they_ban_hans_niemann_from_competitive/
r/AnarchyChess,Submissions,xikh97,t5_2yvry,WTF Hans Niemann Just Got a 100% Accuracy Game. And You Tell Us You Think He Isn't Cheating???,,3r3zepxv,2022-09-19 18:28:50,314,0.99, ,/r/AnarchyChess/comments/xikh97/wtf_hans_niemann_just_got_a_100_accuracy_game_and/
r/AnarchyChess,Submissions,10cutmq,t5_2yvry,Dream vs Hans Niemann,,8amsu12r,2023-01-15 21:01:04,4,1.0, ,/r/AnarchyChess/comments/10cutmq/dream_vs_hans_niemann/
r/AnarchyChess,Submissions,xr0dn2,t5_2yvry,Timothée Chalamet has been cast as Hans Niemann in the upcoming Netflix documentary,,2wx8xew0,2022-09-29 06:31:09,478,0.98, ,/r/AnarchyChess/comments/xr0dn2/timothée_chalamet_has_been_cast_as_hans_niemann/
r/AnarchyChess,Submissions,xij1ch,t5_2yvry,breaking news: hans niemann defeats magnus carlsen in two moves,,421jg2ro,2022-09-19 17:35:07,1171,0.99, ,/r/AnarchyChess/comments/xij1ch/breaking_news_hans_niemann_defeats_magnus_carlsen/
r/AnarchyChess,Submissions,xrajhc,t5_2yvry,Hans Niemann Confirmed for US Sexiest Man Alive Championship,,ev1ak,2022-09-29 15:19:57,470,0.96, ,/r/AnarchyChess/comments/xrajhc/hans_niemann_confirmed_for_us_sexiest_man_alive/
r/AnarchyChess,Submissions,x7o02t,t5_2yvry,Leaked pre-game footage of Hans Niemann hiding his chess engine from the arbiters,,xy8jn,2022-09-06 22:34:36,1349,0.99, ,/r/AnarchyChess/comments/x7o02t/leaked_pregame_footage_of_hans_niemann_hiding_his/
r/AnarchyChess,Submissions,xx9rqe,t5_2yvry,Hans the exhibitionist,,2cffa08t,2022-10-06 16:38:46,341,0.96, ,/r/AnarchyChess/comments/xx9rqe/hans_the_exhibitionist/
r/AnarchyChess,Submissions,zz1qus,t5_2yvry,Hans Niemann blunders in 11 moves against a 2481 rated player. Black to play and win,,5yrs8pmo,2022-12-30 14:23:24,5,1.0, ,/r/AnarchyChess/comments/zz1qus/hans_niemann_blunders_in_11_moves_against_a_2481/
r/AnarchyChess,Submissions,104mj1b,t5_2yvry,I’ve heard a lot about this Hans guy cheating. Should I be worried?,,77pd0stm,2023-01-06 06:04:14,9,0.78, ,/r/AnarchyChess/comments/104mj1b/ive_heard_a_lot_about_this_hans_guy_cheating/
r/AnarchyChess,Submissions,x77pyt,t5_2yvry,"If Hans Niemann has a million fans, I'm one of them",,ywnop,2022-09-06 11:06:04,1100,0.98, ,/r/AnarchyChess/comments/x77pyt/if_hans_niemann_has_a_million_fans_im_one_of_them/
r/AnarchyChess,Submissions,xw5ml0,t5_2yvry,Hans tabbing out during games,,3pr69cof,2022-10-05 09:14:51,287,0.99, ,/r/AnarchyChess/comments/xw5ml0/hans_tabbing_out_during_games/
r/AnarchyChess,Submissions,xjj1lz,t5_2yvry,Hans Niemann being prepped to enter his first chess tournament (Age 10),,9znz9nxu,2022-09-20 20:06:00,983,0.98, ,/r/AnarchyChess/comments/xjj1lz/hans_niemann_being_prepped_to_enter_his_first/
r/AnarchyChess,Submissions,yayz56,t5_2yvry,Why do people think Hans cheated? I just played a game with 0 mistakes.,,53ogea5b,2022-10-22 21:20:05,410,0.99, ,/r/AnarchyChess/comments/yayz56/why_do_people_think_hans_cheated_i_just_played_a/
r/AnarchyChess,Submissions,zvneud,t5_2yvry,FIDE commemorates Hans Niemann’s groundbreaking use of anal beads in modern chess theory with a statue in his (and beads’) honour,,3393he7x,2022-12-26 13:44:08,34,0.97, ,/r/AnarchyChess/comments/zvneud/fide_commemorates_hans_niemanns_groundbreaking/
r/AnarchyChess,Submissions,zkugec,t5_2yvry,OpenAI makes a stunning revelation about Hans Niemann,,muzzozaj,2022-12-13 12:24:26,35,0.88, ,/r/AnarchyChess/comments/zkugec/openai_makes_a_stunning_revelation_about_hans/
r/AnarchyChess,Submissions,x6qh50,t5_2yvry,BREAKING: Wesley so has proof that Hans cheated and here it is.,,na,2022-09-05 20:31:32,1066,0.99, ,/r/AnarchyChess/comments/x6qh50/breaking_wesley_so_has_proof_that_hans_cheated/
r/AnarchyChess,Submissions,xkccb3,t5_2yvry,"Magnus Carlsen and Hans Niemann playing on a beach in Miami, Aug 2022",,1iwypvki,2022-09-21 18:09:28,891,0.99, ,/r/AnarchyChess/comments/xkccb3/magnus_carlsen_and_hans_niemann_playing_on_a/
r/AnarchyChess,Submissions,107zpte,t5_2yvry,Should I send Hans this book my brother had on his toilet? It might help him against Magnus.,,ev0ad,2023-01-10 03:52:02,5,1.0, ,/r/AnarchyChess/comments/107zpte/should_i_send_hans_this_book_my_brother_had_on/
r/AnarchyChess,Submissions,xrt2du,t5_2yvry,video demonstration of Hans Anal beads working in real time,,9znz9nxu,2022-09-30 05:19:15,394,0.98, ,/r/AnarchyChess/comments/xrt2du/video_demonstration_of_hans_anal_beads_working_in/
r/AnarchyChess,Submissions,xx9dmy,t5_2yvry,Hans Niemann going through security at the US Open today,,84wgupyy,2022-10-06 16:22:30,296,0.98, ,/r/AnarchyChess/comments/xx9dmy/hans_niemann_going_through_security_at_the_us/
r/AnarchyChess,Submissions,y0o8vy,t5_2yvry,My statement on the Magnus Carlsen - Hans Niemann Affair,"Hello, I'm Chess Grandmaster Max Deutsch. The last few weeks have been difficult for me as well as the many talented coaches who work for my algorithm company. I want to take this opportunity to set the record straight on who I am, What my role is pertaining to Hans Niemman, and respond to some of the accusations made against me. I've also provided some analysis of the games I played in 2020 which had me flagged for using my proprietary algorithm to defeat Magnus.

Hopefully, this helps clarify things: [https://sites.google.com/analbeads-vibrator-how-I-did-it]",1xjois2d,2022-10-10 19:52:48,174,0.96, ,/r/AnarchyChess/comments/y0o8vy/my_statement_on_the_magnus_carlsen_hans_niemann/
r/AnarchyChess,Submissions,x7lzs5,t5_2yvry,Why I think Hans cheated vs Magnus,"He said in the post-match interview that he had prepared for that opening. But how does someone usually prepare for openings? Yes you got it right – using **CHESS SOFTWARE.**

So if he had that same position in the same day of the match, as he says in this interview, then the moves weren't his but the **ENGINE'S**. He just replicated them. All calculation was done by the **COMPUTER**.

So there you have it.",5hts99if,2022-09-06 21:11:56,166,0.99, ,/r/AnarchyChess/comments/x7lzs5/why_i_think_hans_cheated_vs_magnus/
r/AnarchyChess,Submissions,xvr1wv,t5_2yvry,Hans response on cheating allegation,,urpuyz2,2022-10-04 21:19:54,675,0.99, ,/r/AnarchyChess/comments/xvr1wv/hans_response_on_cheating_allegation/
r/AnarchyChess,Submissions,xixsor,t5_2yvry,Magnus vs Hans but Magnus is portrayed by a cat,,47zagab4,2022-09-20 03:29:38,734,0.99, ,/r/AnarchyChess/comments/xixsor/magnus_vs_hans_but_magnus_is_portrayed_by_a_cat/
