subreddit,type,id,subreddit_name,title,text,author_id,created_utc,score,upvote_ratio,blank,permalink
r/AnarchyChess,Submissions,zhxydl,t5_2yvry,An Epic Story: Magnus vs Hans,"Once upon a time, in a far-off land, there lived a young boy named Magnus Carlsen. Despite his young age, Magnus was incredibly cunning and intelligent, and he possessed a strange power - the ability to control bananas
Magnus's banana powers were unique and incredibly quirky. He could use his powers to make bananas sing and dance, which he would use to distract and confuse his enemies. He could also use his powers to make bananas incredibly soft and squishy, which he would use to cushion his falls and protect himself from harm. But his most bizarre power was the ability to make bananas extremely spicy, which he would use to burn and irritate his enemies' eyes and noses.

At first, Magnus used his powers for good, helping the people of his village by using his banana powers to protect them from harm. But as he grew older, Magnus's powers grew stronger and he began to crave more and more power.
Eventually, Magnus's thirst for power consumed him, and he turned to the dark side, using his banana powers for evil. He would use his powers to manipulate the people of his village, forcing them to do his bidding and carry out his evil plans.
One day, Magnus's reign of terror came to the attention of a great hero, who immediately set out to stop him.

As the hero and Magnus prepared to face off in a final battle, the people of the village held their breath, waiting to see who would emerge victorious. But the outcome of the battle was not yet known...

Hans Niemann was just a normal kid, living a simple life in a small village. He didn't have any extraordinary powers or abilities, and he was content with the way things were.

But one day, everything changed. Hans discovered that he had a unique power - the ability to stretch out his anus incredibly wide. At first, he was unsure of how to use this power, and he kept it a secret from everyone, including his family and friends.

But as Hans grew older, he realized that his power could be used for good. He began to use his power to help the people of his village, using his wide anus to suck up debris and trash that littered the streets, and even to rescue people who were trapped in tight spaces.

With his newfound power, Hans became a hero to the people of his village, and they praised him for his bravery and selflessness.

As the battle between Hans and Magnus raged on, Hans knew that he would need to use his unique power to its full potential in order to defeat Magnus and his quirky banana powers.

Hans focused his energy and began to stretch out his anus to its maximum capacity. As he did so, he felt a powerful suction force building up within him, and he used this force to suck up Magnus's singing and dancing bananas.

Magnus, taken aback by Hans's strange power, was unable to stop him, and his bananas were quickly sucked up into Hans's wide anus.

But Magnus was not deterred. He quickly conjured up a new batch of bananas, this time making them incredibly spicy. He threw them at Hans, hoping to burn and irritate his eyes and nose.

Hans, caught off guard by the spicy bananas, felt a burning sensation in his anus as the spicy bananas entered his body. He gritted his teeth and fought through the pain, determined to defeat Magnus and protect his village.

Despite the searing pain in his anus, Hans continued to use his suction power to suck up the spicy bananas. He used his powerful anus muscles to squeeze the bananas, but the spicy juice only seemed to make the pain worse.

Hans could feel the skin around his anus begin to burn and blister, and he could barely hold on to the bananas as they slipped through his fingers. But still, he refused to give up.

Finally, after what seemed like an eternity, Hans was able to squeeze the last of the spicy bananas into a pulp. The pain in his anus was almost unbearable, but he knew that he had to continue the fight.

Hans used his suction power to pull Magnus towards him, and then he used his powerful anus muscles to trap Magnus inside.
Inside Hans's wide anus, Magnus struggled and writhed in pain as the spicy banana pulp coated his body. The juice burned his skin, and the pulp clogged his nostrils and mouth, making it difficult for him to breathe.
Hans, filled with anger and determination, squeezed his anus muscles even tighter, crushing Magnus and causing him even more pain.
But instead of showing mercy, Hans continued to squeeze, determined to make Magnus suffer for his actions.
Finally, after what seemed like an eternity, Magnus's struggles grew weaker and weaker, until he was finally still.
Hans, victorious, released his grip on Magnus and let his lifeless body fall to the ground.
The people of the village, horrified by the gruesome scene, cheered and celebrated Hans's victory. They hailed him as a hero and praised him for his bravery and determination.
And Hans, the hero with the stretchy anus, was celebrated as a hero and celebrated for his bravery and determination, despite the intense pain and discomfort he had suffered. He had saved his village from Magnus and his quirky banana powers, and he would be remembered as a hero for generations to come.

~~ made by gpt-3",g1f67c6i,2022-12-10 17:21:14,3,0.8, ,/r/AnarchyChess/comments/zhxydl/an_epic_story_magnus_vs_hans/
r/AnarchyChess,Submissions,xa97wo,t5_2yvry,This much hair growth is not possible in such a short time. This goes deeper than beads. Hans is using the hyperbolic time chamber to train,,dxmxtsc3,2022-09-09 23:00:18,118,1.0, ,/r/AnarchyChess/comments/xa97wo/this_much_hair_growth_is_not_possible_in_such_a/
r/AnarchyChess,Submissions,x9ublc,t5_2yvry,Chess.com Public Response to Banning of Hans Niemann,,2doktvx6,2022-09-09 12:32:36,402,0.98, ,/r/AnarchyChess/comments/x9ublc/chesscom_public_response_to_banning_of_hans/
r/AnarchyChess,Submissions,y8u11x,t5_2yvry,This photo of Hans after the game with Samuel Sevian reminded me of something,,hcx58,2022-10-20 10:01:11,135,0.97, ,/r/AnarchyChess/comments/y8u11x/this_photo_of_hans_after_the_game_with_samuel/
r/AnarchyChess,Submissions,yw611l,t5_2yvry,Magnus Carlsen FINALLY Explains What Happened At the Sinquefield Cup with Hans,,na,2022-11-15 18:48:38,11,0.92, ,/r/AnarchyChess/comments/yw611l/magnus_carlsen_finally_explains_what_happened_at/
r/AnarchyChess,Submissions,x9xl5s,t5_2yvry,I have discovered a truly marvelous proof that Hans cheated,"However, Magnus’s tweet is not large enough to contain it.",7sxsudx,2022-09-09 14:54:13,118,0.96, ,/r/AnarchyChess/comments/x9xl5s/i_have_discovered_a_truly_marvelous_proof_that/
r/AnarchyChess,Submissions,xj1m1p,t5_2yvry,"Magnus' girlfriend, Elisabet Lorentzen Djønne, should fuck Hans","It is clear Magnus is going through a mental breakdown. He is unstable. He's a pussy, he's a bitch. He might even be gay. 

He has no evidence that Hans did anything wrong. Yet, he is completely throwing his career away. Nobody will ever trust Magnus again. His career will fail, his businesses will crumble. 

Elisabet is a beautiful girl. She should cut her losses now before it's too late! Magnus is unstable, he won't be able to raise a family. He would probably end up abusing their kids anyway. 

Elisabet should fuck Hans instead. He is alpha, better chess player. Better businessman. Hans is the GOAT, and the future of chess. Thoughts?",na,2022-09-20 06:55:34,21,0.68, ,/r/AnarchyChess/comments/xj1m1p/magnus_girlfriend_elisabet_lorentzen_djønne/
r/AnarchyChess,Submissions,xl3tld,t5_2yvry,r/chess during Magnus-Hans drama analyzing every single word anyone said ever,,3answjxm,2022-09-22 15:02:12,121,0.99, ,/r/AnarchyChess/comments/xl3tld/rchess_during_magnushans_drama_analyzing_every/
r/AnarchyChess,Submissions,xjqgpv,t5_2yvry,Hans Niemann cheating OTB,,dxmxtsc3,2022-09-21 01:10:07,27,0.95, ,/r/AnarchyChess/comments/xjqgpv/hans_niemann_cheating_otb/
r/AnarchyChess,Submissions,z12dk6,t5_2yvry,How is Hans Niemann’s name pronounced?,Is it like Hans or Hans? Pawns Niemann???,7sdojk8i,2022-11-21 15:54:39,2,1.0, ,/r/AnarchyChess/comments/z12dk6/how_is_hans_niemanns_name_pronounced/
r/AnarchyChess,Submissions,y54t6c,t5_2yvry,"Hans ""World Champion Gigachad"" Niemann winning a US championship match through forced en passant",,jggxq9lo,2022-10-16 02:00:37,101,0.97, ,/r/AnarchyChess/comments/y54t6c/hans_world_champion_gigachad_niemann_winning_a_us/
r/AnarchyChess,Submissions,y8jxcp,t5_2yvry,How Hans Cheated: The Bucket Glitch,,pjmphcvi,2022-10-20 01:04:29,31,0.94, ,/r/AnarchyChess/comments/y8jxcp/how_hans_cheated_the_bucket_glitch/
r/AnarchyChess,Submissions,y9gfym,t5_2yvry,New Hans theory stopped,,pw5f6jil,2022-10-21 01:48:28,286,1.0, ,/r/AnarchyChess/comments/y9gfym/new_hans_theory_stopped/
r/AnarchyChess,Submissions,y0fvrd,t5_2yvry,OnlyHans LIVE,,gdum0m59,2022-10-10 14:15:16,66,1.0, ,/r/AnarchyChess/comments/y0fvrd/onlyhans_live/
r/AnarchyChess,Submissions,xwnsyz,t5_2yvry,Video of Hans Neimann being arrested for cheating in the US Chess Championship,,ggk4f,2022-10-05 22:04:21,35,0.95, ,/r/AnarchyChess/comments/xwnsyz/video_of_hans_neimann_being_arrested_for_cheating/
r/AnarchyChess,Submissions,x92glz,t5_2yvry,BREAKING NEWS: MAGNUS CARLSEN RELEASES STATEMENT ON HANS SITUATION,,8ciw72n8,2022-09-08 14:49:42,143,0.95, ,/r/AnarchyChess/comments/x92glz/breaking_news_magnus_carlsen_releases_statement/
r/AnarchyChess,Submissions,xi5vwz,t5_2yvry,Han Sneeman,,c6zd50xq,2022-09-19 08:18:08,2894,0.99, ,/r/AnarchyChess/comments/xi5vwz/han_sneeman/
r/AnarchyChess,Submissions,yad55u,t5_2yvry,"I am Hans Niemann, AMA",,fopq8zgj,2022-10-22 03:42:11,6,0.8, ,/r/AnarchyChess/comments/yad55u/i_am_hans_niemann_ama/
r/AnarchyChess,Submissions,yb37l5,t5_2yvry,I am not the man who is not hans Neimann. AMA,,g9twdc39,2022-10-23 00:29:01,6,0.75, ,/r/AnarchyChess/comments/yb37l5/i_am_not_the_man_who_is_not_hans_neimann_ama/
r/AnarchyChess,Submissions,xrb489,t5_2yvry,Who is Hans Niemann?,,7yi1k13l,2022-09-29 15:43:11,81,0.92, ,/r/AnarchyChess/comments/xrb489/who_is_hans_niemann/
r/AnarchyChess,Submissions,xy7i97,t5_2yvry,OMG I work at Taco Bell and this is how Hans left his tacos,,kkfqu,2022-10-07 19:11:33,80,0.95, ,/r/AnarchyChess/comments/xy7i97/omg_i_work_at_taco_bell_and_this_is_how_hans_left/
r/AnarchyChess,Submissions,xjy08j,t5_2yvry,Petition to name the Hans-Magnus scandals for analgate and resingate,"So I just learned about [toiletgate](https://en.wiktionary.org/wiki/Toiletgate), and realized that all proper scandals need a name that ends in gate. Is it even a scandal before it gets named? 

Analgate= Sinquefield cup events. Resingate = Julius baer cup events. 

Analgate should be self explanatory. Resingate may sound like it has something to do with resin, but it's a clever word play on resignate (very clever if I may say so myself).",92zpzq9x,2022-09-21 07:23:43,45,0.93, ,/r/AnarchyChess/comments/xjy08j/petition_to_name_the_hansmagnus_scandals_for/
r/AnarchyChess,Submissions,xqlvdk,t5_2yvry,What if Hans Niemann is the modern day version of the bad kid from Searching for Bobby Fischer?,,t8tpa,2022-09-28 19:26:57,19,0.95, ,/r/AnarchyChess/comments/xqlvdk/what_if_hans_niemann_is_the_modern_day_version_of/
r/AnarchyChess,Submissions,xyqtw8,t5_2yvry,"Hans Nieman ""thinking"" of his next move against Magnus Carlsen",,p0x2k08i,2022-10-08 11:50:36,45,0.9, ,/r/AnarchyChess/comments/xyqtw8/hans_nieman_thinking_of_his_next_move_against/
r/AnarchyChess,Submissions,xqyr7p,t5_2yvry,Hans cheating revealed,,elmh5c,2022-09-29 04:57:07,59,0.92, ,/r/AnarchyChess/comments/xqyr7p/hans_cheating_revealed/
r/AnarchyChess,Submissions,yzzw3v,t5_2yvry,Swedish sports news are reporting on the anal bead theory regarding Hans Niemann.,,i4ype,2022-11-20 09:28:39,3,0.8, ,/r/AnarchyChess/comments/yzzw3v/swedish_sports_news_are_reporting_on_the_anal/
r/AnarchyChess,Submissions,xs8lc7,t5_2yvry,Hans comes clean,,cvk9fm4x,2022-09-30 18:25:28,112,0.95, ,/r/AnarchyChess/comments/xs8lc7/hans_comes_clean/
r/AnarchyChess,Submissions,yqxr54,t5_2yvry,Hans Niemann reference in Paths of Glory?!?!,,3ayxtwwp,2022-11-09 22:35:00,28,0.93, ,/r/AnarchyChess/comments/yqxr54/hans_niemann_reference_in_paths_of_glory/
r/AnarchyChess,Submissions,z4qnev,t5_2yvry,If Hans shared his Beads w Magnus...,,h837q2ly,2022-11-25 22:46:18,0,0.43, ,/r/AnarchyChess/comments/z4qnev/if_hans_shared_his_beads_w_magnus/
r/AnarchyChess,Submissions,wq3s7j,t5_2yvry,Based Hans Moke Niemann,,7e77vgs4,2022-08-16 19:51:59,134,0.97, ,/r/AnarchyChess/comments/wq3s7j/based_hans_moke_niemann/
r/AnarchyChess,Submissions,y7dyz7,t5_2yvry,Magnus rocking the Hans hairstyle.,,na,2022-10-18 17:56:17,53,0.98, ,/r/AnarchyChess/comments/y7dyz7/magnus_rocking_the_hans_hairstyle/
r/AnarchyChess,Submissions,y6ug7a,t5_2yvry,The moment when Magnus Carlsen suspected Hans Niemann,,k6lm5te,2022-10-18 02:38:40,22,0.96, ,/r/AnarchyChess/comments/y6ug7a/the_moment_when_magnus_carlsen_suspected_hans/
r/AnarchyChess,Submissions,x86txn,t5_2yvry,Hans says in interview that confessing to cheating was the biggest mistake of his life,,h3uawcdp,2022-09-07 14:38:43,122,0.95, ,/r/AnarchyChess/comments/x86txn/hans_says_in_interview_that_confessing_to/
r/AnarchyChess,Submissions,xdi0s4,t5_2yvry,How Hans cheated. Pink champagne on ice which he tricked his opponent into drinking in order to impair his abilities.,,zkofi,2022-09-13 20:41:16,74,0.97, ,/r/AnarchyChess/comments/xdi0s4/how_hans_cheated_pink_champagne_on_ice_which_he/
r/AnarchyChess,Submissions,xjgtb8,t5_2yvry,"Hans ""beads"" Niemann vs Magnos Carlos - White to play and win!",,jsswmbc4,2022-09-20 18:40:42,26,0.85, ,/r/AnarchyChess/comments/xjgtb8/hans_beads_niemann_vs_magnos_carlos_white_to_play/
r/AnarchyChess,Submissions,yboz6q,t5_2yvry,Why is no one talking about that hans might used this mf?,"&#x200B;

https://preview.redd.it/gggio339llv91.png?width=564&format=png&auto=webp&v=enabled&s=98124edb2680db2ed90a6042ec56d32c65279f6a",7yfht5f1,2022-10-23 18:22:29,4,0.83, ,/r/AnarchyChess/comments/yboz6q/why_is_no_one_talking_about_that_hans_might_used/
r/AnarchyChess,Submissions,xij60t,t5_2yvry,Magnus Carlsen resigns after two moves against Hans Niemann in the Julius Baer Generation Cup,,j5xj1,2022-09-19 17:39:48,115,0.98, ,/r/AnarchyChess/comments/xij60t/magnus_carlsen_resigns_after_two_moves_against/
r/AnarchyChess,Submissions,yj9xmb,t5_2yvry,the drama is finally over. they found one of Hans' bead.,,3ktztpmn,2022-11-01 14:19:29,13,1.0, ,/r/AnarchyChess/comments/yj9xmb/the_drama_is_finally_over_they_found_one_of_hans/
r/AnarchyChess,Submissions,z25dko,t5_2yvry,so that's how Hans cheated,,e8glnnzz,2022-11-22 21:19:33,10,1.0, ,/r/AnarchyChess/comments/z25dko/so_thats_how_hans_cheated/
r/AnarchyChess,Submissions,y5echj,t5_2yvry,It’s very clear Hans does not use anal beads. Everyone knows the strongest orgasm a man can get is from a prostate massage so using this method Hans wouldn’t be able to contain himself and he would be in a much better mood if he was cumming all game.,,go0qq,2022-10-16 11:16:41,20,0.95, ,/r/AnarchyChess/comments/y5echj/its_very_clear_hans_does_not_use_anal_beads/
r/AnarchyChess,Submissions,xpswx9,t5_2yvry,The only one who can stop Hans,,8ciw72n8,2022-09-27 21:14:52,43,0.99, ,/r/AnarchyChess/comments/xpswx9/the_only_one_who_can_stop_hans/
r/AnarchyChess,Submissions,xav40i,t5_2yvry,"2072 World Chess Champion, Hans Niemann",,4lizpr1v,2022-09-10 17:35:07,195,0.98, ,/r/AnarchyChess/comments/xav40i/2072_world_chess_champion_hans_niemann/
r/AnarchyChess,Submissions,xufmcp,t5_2yvry,Hans niemann's childhood leaked!!!,,5cu04ppx,2022-10-03 10:27:24,131,0.95, ,/r/AnarchyChess/comments/xufmcp/hans_niemanns_childhood_leaked/
r/AnarchyChess,Submissions,xvqd5f,t5_2yvry,Magnus accuses Hans of CHICANERY!,,16337u,2022-10-04 20:52:43,39,0.92, ,/r/AnarchyChess/comments/xvqd5f/magnus_accuses_hans_of_chicanery/
r/AnarchyChess,Submissions,xgmozi,t5_2yvry,I just found Hans Niemann's google search history. Case closed.,,hf424,2022-09-17 13:35:33,151,0.96, ,/r/AnarchyChess/comments/xgmozi/i_just_found_hans_niemanns_google_search_history/
r/AnarchyChess,Submissions,x7hlqp,t5_2yvry,What if Hans isn't even a real super GM,Maybe he's just two 1350's under a trench coat,r3x0z,2022-09-06 18:14:35,73,0.97, ,/r/AnarchyChess/comments/x7hlqp/what_if_hans_isnt_even_a_real_super_gm/
r/AnarchyChess,Submissions,xq5ngh,t5_2yvry,German WGM Belenkaya accuses Hans of cheating,"Obviously a joke. She said he was cheating because he used her long move times to calculate his moves.

Personally I still want to see evidence he cheated. Some correlations to engines is not proof.",gxeeq,2022-09-28 07:08:33,25,0.84, ,/r/AnarchyChess/comments/xq5ngh/german_wgm_belenkaya_accuses_hans_of_cheating/
r/AnarchyChess,Submissions,ysw0au,t5_2yvry,Can’t believe Hans Neimann scammed us all out of billions. We trusted him.,,8xx9w4sd,2022-11-12 04:04:51,14,0.89, ,/r/AnarchyChess/comments/ysw0au/cant_believe_hans_neimann_scammed_us_all_out_of/
r/AnarchyChess,Submissions,x7crii,t5_2yvry,Did Hans Niemann cheat? An ANALysis,"Now we all know that based on the Sinquefield Cup's strict anti cheating measures, we can logically deduce that the only way he could have possibly cheated was using anal beads.

Moves could easily be signalled by clenching his butt in morse code.

However, there is some problems with this hypothesis.

**Issue 1: The metal detector**

[In this clip] (https://www.youtube.com/watch?v=PIulWkTHuu0) we see Niemann entire body scanned by a metal detector. Would this not pick up the anal beads?

It likely would. However, it make me possible that Niemann got butt implants to give him cake, and also the silicon would stop any metal detection signals from picking up the butt device.

**Issue 2: Battery life**

I've done some extensive research on remote controlled butt plugs, and most seem to have a maximum of 1 hours of battery life.

These, however, are for pleasure and would require more energy to send a message. Or maybe Niemann is just into that.

It would seem that Niemann would need some non-commercially made, bespoke anal beads, that use less power by vibrating less.

**Issue 3: Cooling**

The first question is, is the anal bead receiving messages for the next move from the outside, or does it have stockfish installed on it directly?

As we covered earlier, to cheat Niemann must have got silicone butt implants, which would stop the beads from receiving any messages from the outside. So Niemann worked alone.

Now, with stockfish installed and running on a computer inside the beads, wouldn't they get far too hot? The only explanation is that prior to the game Niemann consumed several cans of beans so he could fart for cooling.

So now the question is: did anyone see Niemann eating beans?

**Conclusion:**

Niemann may have cheated, but it's only possible if he got butt implants, commissioned bespoke anal beads, and ate an excessive amount of beans before the match. FIDE should follow through accordingly and find out what Niemann had for breakfast.",5rukt,2022-09-06 14:59:45,76,1.0, ,/r/AnarchyChess/comments/x7crii/did_hans_niemann_cheat_an_analysis/
r/AnarchyChess,Submissions,xwmluu,t5_2yvry,Hans didn't cheat. He was detected by Chess.com watching pornography and is keeping silent to make people think he cheated instead.,"all the magnuts latest wild theories about cheating hinge on the so called 'toggling' detected. Well who hasn't 'toggled' to a new tab in the middle of something boring like a chess match to something more entertaining? Like blonde big breasted bodacious babes? Obviously a world class player capable of beating the world champion in two moves is not going to have much of a interesting challenge from anyone and will have to divert his attention elsewhere. The magnuts claim his playing got better after the toggling, well who hasn't experienced the rush of energy in the middle of a good fap or the post coital rush? Maybe he was even jiving to the rhythm of the anal beads? They claim he's done it hundreds of times, don't they know the addictiveness of online boobs? Come on, the dude's been living out of a suitcase for years, a man's got needs are we going to hold getting a little online titillation against him? He's obviously insecure and embarrassed about his porn habit and has been so silent because he wants to mislead people into thinking he's cheated instead. It all fits",oszvvyq,2022-10-05 21:16:06,27,0.92, ,/r/AnarchyChess/comments/xwmluu/hans_didnt_cheat_he_was_detected_by_chesscom/
r/AnarchyChess,Submissions,yajkc1,t5_2yvry,Dr Evil Hans,,cfxwvr6l,2022-10-22 09:53:41,131,0.99, ,/r/AnarchyChess/comments/yajkc1/dr_evil_hans/
r/AnarchyChess,Submissions,x91gli,t5_2yvry,[Non-Anarchy-Submission] So I think I know how they can prove whether or not Hans cheated.,"Edit: imagine not understanding intuitively that this is satire.

This is a non-anarchy submission. It's a serious post, I know it's not the right subreddit but people over at /r/chess aren't really so open to serious discussion sometimes if it goes against their narrative. If this submission isn't welcome here then I apologize.

I think that if they wanted to ascertain whether or not Hans cheated, they need to redo the game but under different circumstances.

The players need to play again in a closed room with only one trusted arbiter, and both players need to be thoroughly searched. 

Most importantly, though, **they need to play the same game again**. They need to agree that from the start they are playing the same game, the same opening sequence. This way, the world can know for sure whether Hans can win against Magnus during that opening with definitely no cheating. If the game is the same with the exact same move order until the end, then we know that Hans did not cheat in the original game. However, if he loses or draws, well, I think that's proof enough that at the very least, something was not right in the original game.

Seems like a pretty fair way to determine, no? Thoughts?",8o2ml,2022-09-08 14:07:57,6,0.67, ,/r/AnarchyChess/comments/x91gli/nonanarchysubmission_so_i_think_i_know_how_they/
r/AnarchyChess,Submissions,xrquy8,t5_2yvry,The Magnus/Hans Situation is Playing Out in Poker Right Now,,icrpgeqf,2022-09-30 03:18:07,52,0.97, ,/r/AnarchyChess/comments/xrquy8/the_magnushans_situation_is_playing_out_in_poker/
r/AnarchyChess,Submissions,y8hofn,t5_2yvry,Hans Niemann chess cheating scandal solved! Play-by-play reenactment!,,ddeuh,2022-10-19 23:22:03,4,0.67, ,/r/AnarchyChess/comments/y8hofn/hans_niemann_chess_cheating_scandal_solved/
r/AnarchyChess,Submissions,xpk1lq,t5_2yvry,Nice try Hans,,agaarpkf,2022-09-27 15:35:09,59,0.97, ,/r/AnarchyChess/comments/xpk1lq/nice_try_hans/
r/AnarchyChess,Submissions,xxhibs,t5_2yvry,The Hans Nie”mann” Conspiracy,,7bu4dkif,2022-10-06 21:55:35,93,0.99, ,/r/AnarchyChess/comments/xxhibs/the_hans_niemann_conspiracy/
r/AnarchyChess,Submissions,xach4f,t5_2yvry,Unpopular Opinion: Hans Cheating Over the Board Would Only Make Him Cooler,"Can you imagine the fucking mission impossible level setup Hans would have needed to cheat? He has to get through security and is not only under constant supervision by anti-cheating personel: but he is also being recorded and livestreamed to the entire internet.

It would honestly take a huge innovation in the field of competitive cheating for Hans to pull this off - and I would gain so much more respect for him if he did.",e8n1cgnt,2022-09-10 01:32:32,89,0.93, ,/r/AnarchyChess/comments/xach4f/unpopular_opinion_hans_cheating_over_the_board/
r/AnarchyChess,Submissions,xvr19a,t5_2yvry,An actual photo of hans getting ready for his mcdonalds job interview tomorrow morning,,13ggxe,2022-10-04 21:19:10,11,0.76, ,/r/AnarchyChess/comments/xvr19a/an_actual_photo_of_hans_getting_ready_for_his/
r/AnarchyChess,Submissions,yacsd7,t5_2yvry,"Hans Niemann sued Sam Sevian for $100M for decapitating his king. ""My king would speak for himself, had he not been decapitated by Sevian,"" the young prodigy said.",,2tazkr10,2022-10-22 03:23:44,27,1.0, ,/r/AnarchyChess/comments/yacsd7/hans_niemann_sued_sam_sevian_for_100m_for/
r/AnarchyChess,Submissions,ya11md,t5_2yvry,"Breaking: Hans Niemann names Nelson of Chess.com in $100M lawsuit, source says",,92lkh6ak,2022-10-21 18:35:01,79,0.98, ,/r/AnarchyChess/comments/ya11md/breaking_hans_niemann_names_nelson_of_chesscom_in/
r/AnarchyChess,Submissions,ygol7i,t5_2yvry,The feud is over! Magnus shows his friendship with Hans by dressing as him for Halloween!,,5so4z,2022-10-29 16:50:44,42,1.0, ,/r/AnarchyChess/comments/ygol7i/the_feud_is_over_magnus_shows_his_friendship_with/
r/AnarchyChess,Submissions,xikh8g,t5_2yvry,"Magnus is being ridiculous. No way Hans is cheating, he blundered out of the opening!",,15x0x4,2022-09-19 18:28:48,68,1.0, ,/r/AnarchyChess/comments/xikh8g/magnus_is_being_ridiculous_no_way_hans_is/
r/AnarchyChess,Submissions,xij40h,t5_2yvry,Magnus Carlsen resigns after two moves against Hans Niemann in the Julius Baer Generation Cup,,vjkoo,2022-09-19 17:37:47,79,0.96, ,/r/AnarchyChess/comments/xij40h/magnus_carlsen_resigns_after_two_moves_against/
r/AnarchyChess,Submissions,y7nmg5,t5_2yvry,The disrespect just reached its peak. Sam decapitated Hans' king,,6l45tfvy,2022-10-19 00:23:40,25,1.0, ,/r/AnarchyChess/comments/y7nmg5/the_disrespect_just_reached_its_peak_sam/
r/AnarchyChess,Submissions,xz8a1m,t5_2yvry,Is this proof that Hans is innocent after all?,,97hvfcz1,2022-10-09 00:45:08,5,0.78, ,/r/AnarchyChess/comments/xz8a1m/is_this_proof_that_hans_is_innocent_after_all/
r/AnarchyChess,Submissions,ydr5e5,t5_2yvry,The Beads. A Hans Niemann Original Movie.,,62bxu3cq,2022-10-26 06:43:38,13,0.93, ,/r/AnarchyChess/comments/ydr5e5/the_beads_a_hans_niemann_original_movie/
r/AnarchyChess,Submissions,yoaj5r,t5_2yvry,Hans?,,7qtc0pb8,2022-11-07 02:43:20,17,0.83, ,/r/AnarchyChess/comments/yoaj5r/hans/
