subreddit,type,id,subreddit_name,title,text,author_id,created_utc,score,upvote_ratio,blank,permalink
r/AnarchyChess,Submissions,zkz7dd,t5_2yvry,"Hi I created the AI ""Hans Niemann"" AMA!","Hi I am a researcher in neuronal networks, AI, machine learning. Will soon finish my bachelor. I created an AI called ""Hans Niemann"", AMA! The name ""Hans"" is the most generic German name. ""Niemann"" literally means ""nobody"", so you could translate it as ""John Nobody"". I gave the AI body a Danish background, so no one could place it's accent.",5u35nbfv,2022-12-13 16:04:23,14,0.86, ,/r/AnarchyChess/comments/zkz7dd/hi_i_created_the_ai_hans_niemann_ama/
r/AnarchyChess,Submissions,xvco4w,t5_2yvry,Looks like Hans Niemann has had his little scheme in the works for almost a year! We should’ve known sooner…,,a4yriluw,2022-10-04 11:31:58,810,0.99, ,/r/AnarchyChess/comments/xvco4w/looks_like_hans_niemann_has_had_his_little_scheme/
r/AnarchyChess,Submissions,ym3lsp,t5_2yvry,The only USB hub officially endorsed by Hans Niemann,,chnch25w,2022-11-04 16:34:07,109,0.97, ,/r/AnarchyChess/comments/ym3lsp/the_only_usb_hub_officially_endorsed_by_hans/
r/AnarchyChess,Submissions,xqhngs,t5_2yvry,One of these pictures is Hans Niemann and one is a cheetah. Guess which one is which.,Rumors say that one of them has been a cheetah his hole life. The other one might be a vicious predator looking out for his next victim.,b3s5fste,2022-09-28 16:43:13,357,1.0, ,/r/AnarchyChess/comments/xqhngs/one_of_these_pictures_is_hans_niemann_and_one_is/
r/AnarchyChess,Submissions,103ggu9,t5_2yvry,Hans was using Mittens the entire time??,,2h61f97,2023-01-04 22:01:06,6,1.0, ,/r/AnarchyChess/comments/103ggu9/hans_was_using_mittens_the_entire_time/
r/AnarchyChess,Submissions,xwthnn,t5_2yvry,Are we sure Hans didn’t just memorize the stockfish codebase?,It’s possible he memorized the algorithm for stockfish and is simply executing the code in his head to find the best moves,na,2022-10-06 02:18:35,273,0.99, ,/r/AnarchyChess/comments/xwthnn/are_we_sure_hans_didnt_just_memorize_the/
r/AnarchyChess,Submissions,yc6bl5,t5_2yvry,Hans Niemann is so good at chess his hairline did an En passant,,k59s9kh0,2022-10-24 09:00:37,51,0.93, ,/r/AnarchyChess/comments/yc6bl5/hans_niemann_is_so_good_at_chess_his_hairline_did/
r/AnarchyChess,Submissions,zxk5aw,t5_2yvry,Hans Niemann by Ghais Guevara,,1a3d5qbt,2022-12-28 20:33:06,11,0.93, ,/r/AnarchyChess/comments/zxk5aw/hans_niemann_by_ghais_guevara/
r/AnarchyChess,Submissions,zq92ol,t5_2yvry,Andrew Tate porn parody of Magnus Vs. Hans,,9znz9nxu,2022-12-20 00:42:45,17,0.82, ,/r/AnarchyChess/comments/zq92ol/andrew_tate_porn_parody_of_magnus_vs_hans/
r/AnarchyChess,Submissions,xdmfp9,t5_2yvry,"Hans Niemann awkwardly suggests his opponent should go on a date with him because ""chat"" wants it",,4ewc216i,2022-09-13 23:44:08,177,0.94, ,/r/AnarchyChess/comments/xdmfp9/hans_niemann_awkwardly_suggests_his_opponent/
r/AnarchyChess,Submissions,xtnqy3,t5_2yvry,Statue of Hans Niemann erected in Rotterdam for his achievements in chess,,12gdj9,2022-10-02 12:36:27,536,0.98, ,/r/AnarchyChess/comments/xtnqy3/statue_of_hans_niemann_erected_in_rotterdam_for/
r/AnarchyChess,Submissions,yqs1n0,t5_2yvry,The TV adaptation of the Magnus & Hans drama is finally here...,,je0c4,2022-11-09 18:58:49,61,0.97, ,/r/AnarchyChess/comments/yqs1n0/the_tv_adaptation_of_the_magnus_hans_drama_is/
r/AnarchyChess,Submissions,xsdsbt,t5_2yvry,I am Data Scientist with Bachelor Degree in Computer Science and Mathematics. I crunched the numbers using scientific standarized methods to evaluate the likelihood of cheating in the case of Hans Niemann. Here are my results:,,oi3h5u9s,2022-09-30 21:55:34,119,0.97, ,/r/AnarchyChess/comments/xsdsbt/i_am_data_scientist_with_bachelor_degree_in/
r/AnarchyChess,Submissions,xmguke,t5_2yvry,Proof I was on to Hans before Magnus!!! AMA,,67zoiiz9,2022-09-24 02:42:43,251,0.97, ,/r/AnarchyChess/comments/xmguke/proof_i_was_on_to_hans_before_magnus_ama/
r/AnarchyChess,Submissions,xw3xvc,t5_2yvry,You sent i think hans neimen might have used Invisible Contact Lenses to allow him to See the Chess Pieces??????,,dff4a,2022-10-05 07:33:00,360,0.99, ,/r/AnarchyChess/comments/xw3xvc/you_sent_i_think_hans_neimen_might_have_used/
r/AnarchyChess,Submissions,xmtr0q,t5_2yvry,I work at a sex shop across the street from the St. Louis Chess Club. I have interacted with Hans on multiple occasions,"He's an alright kid - looks much older than a 19-year-old. This will become important later.

First time he came in he didn't put on an accent and spent a long time hanging around the anal section. He asked me what the largest size dildo we stocked was. I told him we had triple XL but we could order in a quad XL if needed. He didn't need that much size and went with the triple XL. I'd say compared to most of the bourgeoisie a-holes that find themselves in there (pun intended) he is one of the easiest people to serve and very appreciative of the work we do.

Second time he came in he ordered a bunch of beads and other accessories, I remember specifically he wanted Lovesense beads that could be operated from a distance. Not that unusual a request. Anyway, I sold him all that and when you spend over $100 bucks we throw in a bottle of free liquor. Me thinking the dude was much older than 19 I didn't even think about it. 

Anyway fast forward a week and my manager's reading all these news articles about 'the biggest cheating scandal in chess' etc and realises he's seen the dude before on our CCTV. Motherfucker realises we've served Hans all this sex shit and booze and he's well under 21. Well my ass was grass and my manager had the lawnmower. In other words, I got fired the same day and apparently the shop is being sued by Chess.com. AND THAT IS THE STORY THEY WON'T TELL US ON CNN",z2hf5,2022-09-24 14:05:09,422,0.99, ,/r/AnarchyChess/comments/xmtr0q/i_work_at_a_sex_shop_across_the_street_from_the/
r/AnarchyChess,Submissions,xwikh7,t5_2yvry,Hans Niemann getting double checked for beads,,6gss6i8j,2022-10-05 18:38:00,207,0.99, ,/r/AnarchyChess/comments/xwikh7/hans_niemann_getting_double_checked_for_beads/
r/AnarchyChess,Submissions,zrxcww,t5_2yvry,I did a thing made Hans' anal cheating device,,3nhpz9lr,2022-12-21 18:53:49,14,1.0, ,/r/AnarchyChess/comments/zrxcww/i_did_a_thing_made_hans_anal_cheating_device/
r/AnarchyChess,Submissions,x7qble,t5_2yvry,Magnus reacts to losing to Hans,,77022,2022-09-07 00:16:50,873,0.99, ,/r/AnarchyChess/comments/x7qble/magnus_reacts_to_losing_to_hans/
r/AnarchyChess,Submissions,xey18x,t5_2yvry,"Hans didn’t just beat Magnus, he rectum",,121v9y,2022-09-15 14:18:46,703,0.99, ,/r/AnarchyChess/comments/xey18x/hans_didnt_just_beat_magnus_he_rectum/
r/AnarchyChess,Submissions,xautow,t5_2yvry,Im Hans Niemanns urologist AMA,,dvoi9g6i,2022-09-10 17:22:54,81,0.95, ,/r/AnarchyChess/comments/xautow/im_hans_niemanns_urologist_ama/
r/AnarchyChess,Submissions,xr65en,t5_2yvry,"To prove that Hans Niemann could have cheated, I played chess against a journalist while using a vibrating cock ring","I’ve been testing for 24 hours so far. Unfortunately I didn’t have anyone to send me the moves, or a journalist to play against, or a chess board. But I think the experiment is going well.",cd56st7b,2022-09-29 12:08:05,447,1.0, ,/r/AnarchyChess/comments/xr65en/to_prove_that_hans_niemann_could_have_cheated_i/
r/AnarchyChess,Submissions,xa9icd,t5_2yvry,Hans Nieman killed the queen of england,,b35zm,2022-09-09 23:12:48,136,0.99, ,/r/AnarchyChess/comments/xa9icd/hans_nieman_killed_the_queen_of_england/
r/AnarchyChess,Submissions,x6txt6,t5_2yvry,Hans god tier revision,,12pdoo,2022-09-05 22:55:43,818,0.99, ,/r/AnarchyChess/comments/x6txt6/hans_god_tier_revision/
r/AnarchyChess,Submissions,zvzrql,t5_2yvry,Hans Niemann Reddit account? Wearing stockfish to beat “M”agnus “C”arlsen1!!11!,,92e5279p,2022-12-26 23:09:00,6,0.87, ,/r/AnarchyChess/comments/zvzrql/hans_niemann_reddit_account_wearing_stockfish_to/
r/AnarchyChess,Submissions,x7ftu0,t5_2yvry,I've finally figured out how Hans has been cheating. He's been using marked pieces for all his games.,,22ro8v9r,2022-09-06 17:03:47,475,1.0, ,/r/AnarchyChess/comments/x7ftu0/ive_finally_figured_out_how_hans_has_been/
r/AnarchyChess,Submissions,xvuw2j,t5_2yvry,Hans Niemann has won - his big plan has paid off,,edij3asf,2022-10-05 00:03:34,309,0.98, ,/r/AnarchyChess/comments/xvuw2j/hans_niemann_has_won_his_big_plan_has_paid_off/
r/AnarchyChess,Submissions,yesl7i,t5_2yvry,The predecessor of Hans has been found,,4gw6yhne,2022-10-27 13:54:30,47,0.98, ,/r/AnarchyChess/comments/yesl7i/the_predecessor_of_hans_has_been_found/
r/AnarchyChess,Submissions,y7tg7n,t5_2yvry,Hans Niemann causing a spike in interest in anal beads in the US during the last 7 weeks,,787i7mga,2022-10-19 05:03:57,107,0.96, ,/r/AnarchyChess/comments/y7tg7n/hans_niemann_causing_a_spike_in_interest_in_anal/
r/AnarchyChess,Submissions,xjitqe,t5_2yvry,Hans Niemann saying how much he loves Hikaru’s stream a year ago. Feelsbadman,,c4frmpdc,2022-09-20 19:57:56,122,0.97, ,/r/AnarchyChess/comments/xjitqe/hans_niemann_saying_how_much_he_loves_hikarus/
r/AnarchyChess,Submissions,x70u6c,t5_2yvry,I'm not Hans Niemann and I'm not a cheater. AMA.,,7y31ecez,2022-09-06 04:19:47,84,0.97, ,/r/AnarchyChess/comments/x70u6c/im_not_hans_niemann_and_im_not_a_cheater_ama/
r/AnarchyChess,Submissions,xnv6zp,t5_2yvry,Magnus and Hans played a non-standard board game and this position appeared. What is the best move after e4?,,7zbsu,2022-09-25 18:34:50,231,0.99, ,/r/AnarchyChess/comments/xnv6zp/magnus_and_hans_played_a_nonstandard_board_game/
r/AnarchyChess,Submissions,y7mkx4,t5_2yvry,Sam Sevian vs Hans Niemann - 2022 US Championship,,z8nvv,2022-10-18 23:37:09,250,0.99, ,/r/AnarchyChess/comments/y7mkx4/sam_sevian_vs_hans_niemann_2022_us_championship/
r/AnarchyChess,Submissions,zfirm1,t5_2yvry,Hans Niemann is Beethoven???,,4nzat1si,2022-12-08 00:05:52,23,0.96, ,/r/AnarchyChess/comments/zfirm1/hans_niemann_is_beethoven/
r/AnarchyChess,Submissions,x77vak,t5_2yvry,Wesley So's take on Hans Niemann's post-match analysis,,94n2at9j,2022-09-06 11:14:14,300,1.0, ,/r/AnarchyChess/comments/x77vak/wesley_sos_take_on_hans_niemanns_postmatch/
r/AnarchyChess,Submissions,x76gpf,t5_2yvry,Hans Niemann is our new Petrosian,,1tftmnbv,2022-09-06 09:54:07,324,0.96, ,/r/AnarchyChess/comments/x76gpf/hans_niemann_is_our_new_petrosian/
r/AnarchyChess,Submissions,xpcrcy,t5_2yvry,How did Hans Niemann cheat? Give me your wildest ideas,,2igcvai,2022-09-27 10:19:31,18,0.93, ,/r/AnarchyChess/comments/xpcrcy/how_did_hans_niemann_cheat_give_me_your_wildest/
r/AnarchyChess,Submissions,xwgww2,t5_2yvry,Basically Hans,,bx2ab,2022-10-05 17:33:40,768,0.98, ,/r/AnarchyChess/comments/xwgww2/basically_hans/
r/AnarchyChess,Submissions,xkgxkk,t5_2yvry,"Hans Niemann, student of Maxim Dlugy, is congratulated for his recent beads (on Dlugy's Facebook)",,6h8n82j3,2022-09-21 21:02:26,286,0.97, ,/r/AnarchyChess/comments/xkgxkk/hans_niemann_student_of_maxim_dlugy_is/
r/AnarchyChess,Submissions,xy048v,t5_2yvry,HOW DID EVERYONE MISS THIS?? Hans caught with contraband at US Chess Championship,,1wzz6zb5,2022-10-07 14:08:41,443,0.98, ,/r/AnarchyChess/comments/xy048v/how_did_everyone_miss_this_hans_caught_with/
r/AnarchyChess,Submissions,xfjp7i,t5_2yvry,Trevor Noah weighs in on Hans Niemann scandal,,8fuja44n,2022-09-16 06:29:48,128,0.9, ,/r/AnarchyChess/comments/xfjp7i/trevor_noah_weighs_in_on_hans_niemann_scandal/
r/AnarchyChess,Submissions,xqzou9,t5_2yvry,"One of these charts is the ""Astrological Natal Chart"" of Hans Niemann, one is of a top super-GM. Which is which? If one of these charts indicates cheating, explain why. Names will be revealed in 12 hours.",,3zk5l,2022-09-29 05:50:15,69,0.95, ,/r/AnarchyChess/comments/xqzou9/one_of_these_charts_is_the_astrological_natal/
r/AnarchyChess,Submissions,xrp7fy,t5_2yvry,Bombshell story from Ben Finegold - Not looking good for Hans,,edij3asf,2022-09-30 01:54:25,399,0.99, ,/r/AnarchyChess/comments/xrp7fy/bombshell_story_from_ben_finegold_not_looking/
r/AnarchyChess,Submissions,xb8zvr,t5_2yvry,Hans fans arrive at the STL chess club,,be65dx24,2022-09-11 04:19:37,1099,1.0, ,/r/AnarchyChess/comments/xb8zvr/hans_fans_arrive_at_the_stl_chess_club/
r/AnarchyChess,Submissions,x73gaw,t5_2yvry,Magnus Carlsen's official statement on Hans Niemann," I am not crazy! I know he used an engine to beat me. I knew he couldn't beat me. I’m Magnus Carlsen. As if I could ever lose a match. Never. Never! I just - I just couldn't prove it. He covered his tracks, he got that idiot at FIDE to unban him. You think this is something? You think this is bad? This? This chicanery? He's done worse. Engine cheating! Are you telling me that a man just happens to play perfectly like that? No! He cheated! Niemann! He declined En passant! And I Didn't brick him! And I should have. Tried to save his PIPI! What was I thinking? He'll never change. He'll never change! Ever since he was 9, always the same! Couldn't keep his hands out of the brick drawer! But not our Niemann! Couldn't be precious Niemann! Bricking them blind! And HE gets to beat me? What a sick joke! I should've stopped him when I had the chance! And you have to ban him, you…",mcumhkmw,2022-09-06 06:47:28,267,0.97, ,/r/AnarchyChess/comments/x73gaw/magnus_carlsens_official_statement_on_hans_niemann/
r/AnarchyChess,Submissions,xp12b9,t5_2yvry,Hans responds to Magnus on twitter,,drczl,2022-09-27 00:30:50,556,0.99, ,/r/AnarchyChess/comments/xp12b9/hans_responds_to_magnus_on_twitter/
r/AnarchyChess,Submissions,xabqpb,t5_2yvry,GM Hans Niemann has been permanently banned from Saint Louis Chess Club after being caught eating one of Magnus Carlsen's pawns while the arbiter wasn't looking.,,vbq1a,2022-09-10 00:57:43,453,0.99, ,/r/AnarchyChess/comments/xabqpb/gm_hans_niemann_has_been_permanently_banned_from/
r/AnarchyChess,Submissions,zlxkmd,t5_2yvry,"Is it just me, or does anyone else think this is Hans Niemann for a brief second when they scroll by this ad?",,8f27jwqh,2022-12-14 17:55:00,10,1.0, ,/r/AnarchyChess/comments/zlxkmd/is_it_just_me_or_does_anyone_else_think_this_is/
r/AnarchyChess,Submissions,xvwecw,t5_2yvry,chess.com added a hans bot!,,87n1khui,2022-10-05 01:11:23,209,1.0, ,/r/AnarchyChess/comments/xvwecw/chesscom_added_a_hans_bot/
r/AnarchyChess,Submissions,xkeytb,t5_2yvry,Appreciation post for Hans Niemann who has done so much to promote anal beads in my ass,,2m0wghth,2022-09-21 19:49:55,446,0.98, ,/r/AnarchyChess/comments/xkeytb/appreciation_post_for_hans_niemann_who_has_done/
r/AnarchyChess,Submissions,xg552j,t5_2yvry,"I went on this sub for the first time in a month and I haven’t seen any en passant jokes or similar, all I see is memes about Hans Nieman. Can someone please explain recent sub happenings to me?","I have no idea what’s going on, please help.",8b0pyw28,2022-09-16 22:34:41,42,0.86, ,/r/AnarchyChess/comments/xg552j/i_went_on_this_sub_for_the_first_time_in_a_month/
r/AnarchyChess,Submissions,xp9ph4,t5_2yvry,Hans counters Magnus with a statement of his own.,,9klsk4a,2022-09-27 07:23:05,95,0.98, ,/r/AnarchyChess/comments/xp9ph4/hans_counters_magnus_with_a_statement_of_his_own/
r/AnarchyChess,Submissions,zm849q,t5_2yvry,Someone is trying to imply Hans is guilty.,,rygrp,2022-12-15 01:15:31,5,0.79, ,/r/AnarchyChess/comments/zm849q/someone_is_trying_to_imply_hans_is_guilty/
r/AnarchyChess,Submissions,x77xzd,t5_2yvry,The man behind the curtain feeding Hans engine moves,,4itbm,2022-09-06 11:18:27,612,1.0, ,/r/AnarchyChess/comments/x77xzd/the_man_behind_the_curtain_feeding_hans_engine/
r/AnarchyChess,Submissions,x7y3xd,t5_2yvry,I designed the butt plug that Hans Niemann used to cheat AMA,Hi I’m world renowned industrialist and billionaire H.E. Pennypacker most recently known for inventing the SmartButt (tm) Buttplug that Hans Niemann used to cheat at the Sinq. And beat Mango Carleton. AMA!,dxmxtsc3,2022-09-07 06:52:36,91,1.0, ,/r/AnarchyChess/comments/x7y3xd/i_designed_the_butt_plug_that_hans_niemann_used/
r/AnarchyChess,Submissions,xy9egz,t5_2yvry,Approved by Hans!,,5ebdl,2022-10-07 20:30:31,270,0.98, ,/r/AnarchyChess/comments/xy9egz/approved_by_hans/
r/AnarchyChess,Submissions,x8jp3w,t5_2yvry,"Hans Niemann emerging from his suitcase after studying chess for 4,500 hours straight.",,8ciw72n8,2022-09-07 23:16:15,496,0.99, ,/r/AnarchyChess/comments/x8jp3w/hans_niemann_emerging_from_his_suitcase_after/
r/AnarchyChess,Submissions,yyloys,t5_2yvry,"White to move, mate in 2 (this had Hans Niemann thinking for less than a minute against Magnus Carlsen)",,icrpgeqf,2022-11-18 14:40:32,5,0.78, ,/r/AnarchyChess/comments/yyloys/white_to_move_mate_in_2_this_had_hans_niemann/
r/AnarchyChess,Submissions,xtcegw,t5_2yvry,"Hans didn't cheat, Magnus is a crybaby and his fragile ego couldn't take the obvious better player winning.",,65t5ssir,2022-10-02 01:53:15,28,0.83, ,/r/AnarchyChess/comments/xtcegw/hans_didnt_cheat_magnus_is_a_crybaby_and_his/
r/AnarchyChess,Submissions,y9gvpd,t5_2yvry,Hans Niemann’s chess set after getting 100 million from Magnus,,dxmxtsc3,2022-10-21 02:09:37,102,0.98, ,/r/AnarchyChess/comments/y9gvpd/hans_niemanns_chess_set_after_getting_100_million/
r/AnarchyChess,Submissions,yd95a1,t5_2yvry,Hans Cross-examination Preview,,gmqiu,2022-10-25 16:32:11,73,0.93, ,/r/AnarchyChess/comments/yd95a1/hans_crossexamination_preview/
r/AnarchyChess,Submissions,xycpiw,t5_2yvry,Hans-free chess engine,,eoc0x,2022-10-07 22:53:40,86,0.96, ,/r/AnarchyChess/comments/xycpiw/hansfree_chess_engine/
r/AnarchyChess,Submissions,xju5gu,t5_2yvry,"Magnus Carlsen and Hans Niemann playing on a beach in Miami, Aug 2002",,71453,2022-09-21 03:58:08,190,0.99, ,/r/AnarchyChess/comments/xju5gu/magnus_carlsen_and_hans_niemann_playing_on_a/
r/AnarchyChess,Submissions,ybvld5,t5_2yvry,BLOOMBERG: Hans Niemann's $100 Million Chess Lawsuit is a Brilliant Move,,qcuywqao,2022-10-23 23:02:05,16,1.0, ,/r/AnarchyChess/comments/ybvld5/bloomberg_hans_niemanns_100_million_chess_lawsuit/
r/AnarchyChess,Submissions,zm4fao,t5_2yvry,PROOF Hans didn't cheat (REAL),,9bjb4,2022-12-14 22:35:29,4,0.84, ,/r/AnarchyChess/comments/zm4fao/proof_hans_didnt_cheat_real/
r/AnarchyChess,Submissions,xpmjwl,t5_2yvry,Hans is sussy baka,,74uau,2022-09-27 17:10:31,278,0.98, ,/r/AnarchyChess/comments/xpmjwl/hans_is_sussy_baka/
r/AnarchyChess,Submissions,xaieim,t5_2yvry,"A look at Hans Niemann's full results in his last 10 classical tournaments(including the Sinquefield Cup) and performance ratings. In total, he's played 71 games, scoring 48/71(67.6%) against an average opponent rating of 2610, giving the engine he uses a performance rating of 2728 FIDE.",,8gy5z,2022-09-10 06:49:13,134,0.96, ,/r/AnarchyChess/comments/xaieim/a_look_at_hans_niemanns_full_results_in_his_last/
r/AnarchyChess,Submissions,y7b4bp,t5_2yvry,(OF) my one line drawing of Hans Niemann winning against Magnus Carlsen with Black at the Sinquefield Cup,,kyn9kquz,2022-10-18 16:06:21,15,0.87, ,/r/AnarchyChess/comments/y7b4bp/of_my_one_line_drawing_of_hans_niemann_winning/
r/AnarchyChess,Submissions,yi9bik,t5_2yvry,Hans looks so much older here... How many years from now this picture will be taken? Or it's just emotional damage from the trial?,,v1s9e,2022-10-31 11:40:15,24,0.95, ,/r/AnarchyChess/comments/yi9bik/hans_looks_so_much_older_here_how_many_years_from/
r/AnarchyChess,Submissions,yob3tp,t5_2yvry,Found Hans,,4sukznlv,2022-11-07 03:11:15,9,1.0, ,/r/AnarchyChess/comments/yob3tp/found_hans/
r/AnarchyChess,Submissions,x87fj4,t5_2yvry,"I am Franz Niemann, unknown twin brother of Hans, rated 2850, and I play the Sinquefield Cup this year. AMA",,4y0wibvr,2022-09-07 15:03:15,83,1.0, ,/r/AnarchyChess/comments/x87fj4/i_am_franz_niemann_unknown_twin_brother_of_hans/
r/AnarchyChess,Submissions,xqnedt,t5_2yvry,Hans Eggman 😎,,cvk9fm4x,2022-09-28 20:26:15,601,0.99, ,/r/AnarchyChess/comments/xqnedt/hans_eggman/
r/AnarchyChess,Submissions,xqwpi3,t5_2yvry,"Dear Redditors: If you torture Hans long enough, he will confess anything","Dear Redditors,

The dimwits over at r/chess are currently misusing stats and calling for Hans’ head. Even Hikaru has said if Hans doesn’t give Magnus permission to speak it means he’s guilty. 

I would like to remind everyone that if you torture someone enough - be it physical or psychological - they will eventually crumble and admit to anything. They’ve already coerced him into saying he’s cheated in the past, which we all know to be false. 

The torture isn’t only psychological, it’s been rumoured to have gotten physical too. DNA analysis has been done on several FIDE official bricks and found Hans’ DNA on them, even though we all know he’d never decline en passant. A 19 year old can only withstand so much until he caves and makes stuff up to make it go away. We must take a stand against this abuse over at r/chess if we want to protect the integrity of our game!",icrpgeqf,2022-09-29 03:11:24,158,0.98, ,/r/AnarchyChess/comments/xqwpi3/dear_redditors_if_you_torture_hans_long_enough_he/
